{
  "project_id": "PRJ-2026-001",
  "project_name": "客戶管理平台 v2.0",
  "questionnaire_version": "1.0.0",
  "created_at": "2026-03-13T10:00:00Z",
  "updated_at": "2026-03-13T14:30:00Z",
  "status": "approved",
  "answers": [
    {
      "question_id": "project_basic.profile.name",
      "value": "客戶管理平台 v2.0",
      "answered_by": { "user_id": "U001", "role": "pm", "name": "王經理" },
      "answered_at": "2026-03-13T10:05:00Z",
      "review_status": "approved",
      "confidence": "confirmed"
    },
    {
      "question_id": "project_basic.profile.type",
      "value": "web_application",
      "answered_by": { "user_id": "U001", "role": "pm", "name": "王經理" },
      "answered_at": "2026-03-13T10:06:00Z",
      "review_status": "approved",
      "confidence": "confirmed"
    },
    {
      "question_id": "project_basic.profile.scope",
      "value": "medium",
      "answered_by": { "user_id": "U001", "role": "pm", "name": "王經理" },
      "answered_at": "2026-03-13T10:07:00Z",
      "review_status": "approved",
      "confidence": "confirmed"
    },
    {
      "question_id": "project_basic.profile.is_new",
      "value": "extension",
      "answered_by": { "user_id": "U001", "role": "pm", "name": "王經理" },
      "answered_at": "2026-03-13T10:08:00Z",
      "review_status": "approved",
      "confidence": "confirmed",
      "notes": "基於 v1.0 系統，新增報表模組與 API 整合"
    },
    {
      "question_id": "project_basic.compliance.data_sensitivity",
      "value": "confidential",
      "answered_by": { "user_id": "U001", "role": "pm", "name": "王經理" },
      "answered_at": "2026-03-13T10:10:00Z",
      "review_status": "approved",
      "confidence": "confirmed",
      "notes": "含客戶個資與聯絡資訊"
    },
    {
      "question_id": "architecture.pattern.style",
      "value": "modular_monolith",
      "answered_by": { "user_id": "U002", "role": "architect", "name": "陳架構師" },
      "answered_at": "2026-03-13T10:30:00Z",
      "review_status": "approved",
      "confidence": "confirmed"
    },
    {
      "question_id": "architecture.pattern.layers",
      "value": ["presentation", "application", "domain", "infrastructure", "data_access"],
      "answered_by": { "user_id": "U002", "role": "architect", "name": "陳架構師" },
      "answered_at": "2026-03-13T10:32:00Z",
      "review_status": "approved",
      "confidence": "confirmed"
    },
    {
      "question_id": "architecture.hosting.platform",
      "value": "azure",
      "answered_by": { "user_id": "U002", "role": "architect", "name": "陳架構師" },
      "answered_at": "2026-03-13T10:35:00Z",
      "review_status": "approved",
      "confidence": "confirmed"
    },
    {
      "question_id": "backend.runtime.platform",
      "value": "dotnet",
      "answered_by": { "user_id": "U003", "role": "backend_lead", "name": "林工程師" },
      "answered_at": "2026-03-13T11:00:00Z",
      "review_status": "approved",
      "confidence": "confirmed"
    },
    {
      "question_id": "backend.runtime.dotnet_version",
      "value": "net8",
      "answered_by": { "user_id": "U003", "role": "backend_lead", "name": "林工程師" },
      "answered_at": "2026-03-13T11:01:00Z",
      "review_status": "approved",
      "confidence": "confirmed"
    },
    {
      "question_id": "backend.framework.dotnet_type",
      "value": "webapi",
      "answered_by": { "user_id": "U003", "role": "backend_lead", "name": "林工程師" },
      "answered_at": "2026-03-13T11:02:00Z",
      "review_status": "approved",
      "confidence": "confirmed"
    },
    {
      "question_id": "backend.orm.choice",
      "value": "ef_core",
      "answered_by": { "user_id": "U003", "role": "backend_lead", "name": "林工程師" },
      "answered_at": "2026-03-13T11:05:00Z",
      "review_status": "approved",
      "confidence": "confirmed"
    },
    {
      "question_id": "backend.auth.method",
      "value": "jwt",
      "answered_by": { "user_id": "U003", "role": "backend_lead", "name": "林工程師" },
      "answered_at": "2026-03-13T11:10:00Z",
      "review_status": "approved",
      "confidence": "confirmed"
    },
    {
      "question_id": "frontend.framework.choice",
      "value": "react",
      "answered_by": { "user_id": "U004", "role": "frontend_lead", "name": "張前端" },
      "answered_at": "2026-03-13T11:30:00Z",
      "review_status": "approved",
      "confidence": "confirmed"
    },
    {
      "question_id": "frontend.language.typescript",
      "value": "strict",
      "answered_by": { "user_id": "U004", "role": "frontend_lead", "name": "張前端" },
      "answered_at": "2026-03-13T11:31:00Z",
      "review_status": "approved",
      "confidence": "confirmed"
    },
    {
      "question_id": "frontend.ui.component_library",
      "value": "ant_design",
      "answered_by": { "user_id": "U004", "role": "frontend_lead", "name": "張前端" },
      "answered_at": "2026-03-13T11:32:00Z",
      "review_status": "approved",
      "confidence": "confirmed"
    },
    {
      "question_id": "database.primary.engine",
      "value": "azure_sql",
      "answered_by": { "user_id": "U003", "role": "backend_lead", "name": "林工程師" },
      "answered_at": "2026-03-13T12:00:00Z",
      "review_status": "approved",
      "confidence": "confirmed"
    },
    {
      "question_id": "database.sensitive_data.handling",
      "value": ["encryption_at_rest", "encryption_in_transit", "hashing", "audit_log"],
      "answered_by": { "user_id": "U003", "role": "backend_lead", "name": "林工程師" },
      "answered_at": "2026-03-13T12:05:00Z",
      "review_status": "approved",
      "confidence": "confirmed"
    },
    {
      "question_id": "deployment.cicd.platform",
      "value": "github_actions",
      "answered_by": { "user_id": "U005", "role": "devops", "name": "黃維運" },
      "answered_at": "2026-03-13T13:00:00Z",
      "review_status": "approved",
      "confidence": "confirmed"
    },
    {
      "question_id": "ai_collaboration.tools.primary",
      "value": ["cursor", "claude"],
      "answered_by": { "user_id": "U002", "role": "architect", "name": "陳架構師" },
      "answered_at": "2026-03-13T14:00:00Z",
      "review_status": "approved",
      "confidence": "confirmed"
    },
    {
      "question_id": "ai_collaboration.scope.allowed",
      "value": ["code_generation", "code_review", "unit_test", "documentation", "refactoring", "api_design"],
      "answered_by": { "user_id": "U002", "role": "architect", "name": "陳架構師" },
      "answered_at": "2026-03-13T14:05:00Z",
      "review_status": "approved",
      "confidence": "confirmed"
    },
    {
      "question_id": "ai_collaboration.scope.prohibited",
      "value": ["production_deploy", "db_migration_prod", "secret_handling", "pii_processing", "delete_operations"],
      "answered_by": { "user_id": "U002", "role": "architect", "name": "陳架構師" },
      "answered_at": "2026-03-13T14:10:00Z",
      "review_status": "approved",
      "confidence": "confirmed"
    },
    {
      "question_id": "ai_collaboration.review.process",
      "value": "mandatory_review",
      "answered_by": { "user_id": "U002", "role": "architect", "name": "陳架構師" },
      "answered_at": "2026-03-13T14:15:00Z",
      "review_status": "approved",
      "confidence": "confirmed"
    }
  ],
  "readiness_score": {
    "overall": 82,
    "by_category": {
      "project_basic": 95,
      "architecture": 85,
      "backend": 90,
      "frontend": 80,
      "database": 85,
      "api": 70,
      "security": 75,
      "deployment": 80,
      "ai_collaboration": 85
    },
    "blockers": [],
    "warnings": [
      "API 文件狀態尚未填寫",
      "前端測試工具尚未確認",
      "建議補充 Rate Limiting 策略"
    ]
  }
}
